{
  "aggregate_criteria": {
    "all_beta_sensitivity_checks_passed": true,
    "all_budgets_passed": true,
    "all_negative_controls_passed": true,
    "all_preregistered_implementation_criteria_passed": true,
    "all_time_step_refinements_passed": true,
    "jet_claim_admitted": false
  },
  "arm_run_count": 36,
  "conclusion": "The beta term changes every matched trajectory. The E7 P/Q homomorphic filter is bit-identical to the identity control and has zero dynamical effect. No jet claim is admitted unless every preregistered jet gate passes.",
  "configuration_count": 12,
  "generator": "scripts/run_beta_plane_ablation.py",
  "preregistration_relpath": "data/registry/beta_plane_ablation_preregistration.json",
  "records": [
    {
      "arms": {
        "beta_plane_e7_quotient": {
          "energy_budget_residual": 1.1133241789411386e-11,
          "enstrophy_budget_residual": 6.255359667750593e-10,
          "final_energy": 0.009682753522850144,
          "final_enstrophy": 0.2369421771356717,
          "final_vorticity_sha256": "a3dd1a4219a50f3cbdcd2fb6380846e9303afb183e0ab47fa4af3b1a067496a6",
          "final_window_jet_counts": [
            8,
            8,
            8,
            8,
            8,
            8,
            8,
            8,
            8,
            8,
            8
          ],
          "final_window_mean_zonal_fraction": 0.06303456021982341,
          "final_window_minimum_zonal_fraction": 0.06266611582243241,
          "final_window_modal_jet_count": 8,
          "final_window_modal_jet_count_occupancy": 1.0,
          "final_window_sample_count": 11,
          "final_window_tenth_percentile_zonal_fraction": 0.06273944546330383,
          "initial_energy": 0.009999999999999998,
          "initial_enstrophy": 0.24484432699819603,
          "jet_claim_admitted": false,
          "jet_count": 8,
          "jet_prominence_threshold": 0.007071067811865475,
          "spectral_zonal_energy_fraction": 0.0634047975322351,
          "zonal_kinetic_energy_fraction": 0.06340479753223509
        },
        "beta_plane_identity": {
          "energy_budget_residual": 1.1133241789411386e-11,
          "enstrophy_budget_residual": 6.255359667750593e-10,
          "final_energy": 0.009682753522850144,
          "final_enstrophy": 0.2369421771356717,
          "final_vorticity_sha256": "a3dd1a4219a50f3cbdcd2fb6380846e9303afb183e0ab47fa4af3b1a067496a6",
          "final_window_jet_counts": [
            8,
            8,
            8,
            8,
            8,
            8,
            8,
            8,
            8,
            8,
            8
          ],
          "final_window_mean_zonal_fraction": 0.06303456021982341,
          "final_window_minimum_zonal_fraction": 0.06266611582243241,
          "final_window_modal_jet_count": 8,
          "final_window_modal_jet_count_occupancy": 1.0,
          "final_window_sample_count": 11,
          "final_window_tenth_percentile_zonal_fraction": 0.06273944546330383,
          "initial_energy": 0.009999999999999998,
          "initial_enstrophy": 0.24484432699819603,
          "jet_claim_admitted": false,
          "jet_count": 8,
          "jet_prominence_threshold": 0.007071067811865475,
          "spectral_zonal_energy_fraction": 0.0634047975322351,
          "zonal_kinetic_energy_fraction": 0.06340479753223509
        },
        "f_plane_identity": {
          "energy_budget_residual": 1.1068218824100695e-11,
          "enstrophy_budget_residual": 6.352914583285241e-10,
          "final_energy": 0.00968275353345138,
          "final_enstrophy": 0.23694217741213996,
          "final_vorticity_sha256": "51f26b42c0f692bb63810d83ff5e234675a998b9b2d24dbf15eec299fe83cb8b",
          "final_window_jet_counts": [
            8,
            8,
            8,
            8,
            8,
            8,
            8,
            8,
            8,
            8,
            8
          ],
          "final_window_mean_zonal_fraction": 0.0631116541828073,
          "final_window_minimum_zonal_fraction": 0.06272661932421729,
          "final_window_modal_jet_count": 8,
          "final_window_modal_jet_count_occupancy": 1.0,
          "final_window_sample_count": 11,
          "final_window_tenth_percentile_zonal_fraction": 0.06280303739234136,
          "initial_energy": 0.009999999999999998,
          "initial_enstrophy": 0.24484432699819603,
          "jet_claim_admitted": false,
          "jet_count": 8,
          "jet_prominence_threshold": 0.007071067811865475,
          "spectral_zonal_energy_fraction": 0.06349962340441298,
          "zonal_kinetic_energy_fraction": 0.06349962340441298
        }
      },
      "comparisons": {
        "beta_to_f_plane_relative_vorticity_l2": 0.3642991966664216,
        "quotient_to_identity_maximum_vorticity_error": 0.0
      },
      "criteria": {
        "beta_sensitivity_passed": true,
        "budget_passed": true,
        "negative_control_passed": true
      },
      "grid_size": 24,
      "seed": 11,
      "steps": 50,
      "time_step": 0.01
    },
    {
      "arms": {
        "beta_plane_e7_quotient": {
          "energy_budget_residual": 2.7733764178423936e-12,
          "enstrophy_budget_residual": 1.5614366050131778e-10,
          "final_energy": 0.009682753522800744,
          "final_enstrophy": 0.23694217713447627,
          "final_vorticity_sha256": "eeac8dd2e050f2dad7f108b580ef378fa6bc80ae7fc2cd53124f57a6bde3ebce",
          "final_window_jet_counts": [
            8,
            8,
            8,
            8,
            8,
            8,
            8,
            8,
            8,
            8,
            8,
            8,
            8,
            8,
            8,
            8,
            8,
            8,
            8,
            8,
            8
          ],
          "final_window_mean_zonal_fraction": 0.06303451041537982,
          "final_window_minimum_zonal_fraction": 0.06266611582335216,
          "final_window_modal_jet_count": 8,
          "final_window_modal_jet_count_occupancy": 1.0,
          "final_window_sample_count": 21,
          "final_window_tenth_percentile_zonal_fraction": 0.06273944546425206,
          "initial_energy": 0.009999999999999998,
          "initial_enstrophy": 0.24484432699819603,
          "jet_claim_admitted": false,
          "jet_count": 8,
          "jet_prominence_threshold": 0.007071067811865475,
          "spectral_zonal_energy_fraction": 0.0634047975333728,
          "zonal_kinetic_energy_fraction": 0.06340479753337282
        },
        "beta_plane_identity": {
          "energy_budget_residual": 2.7733764178423936e-12,
          "enstrophy_budget_residual": 1.5614366050131778e-10,
          "final_energy": 0.009682753522800744,
          "final_enstrophy": 0.23694217713447627,
          "final_vorticity_sha256": "eeac8dd2e050f2dad7f108b580ef378fa6bc80ae7fc2cd53124f57a6bde3ebce",
          "final_window_jet_counts": [
            8,
            8,
            8,
            8,
            8,
            8,
            8,
            8,
            8,
            8,
            8,
            8,
            8,
            8,
            8,
            8,
            8,
            8,
            8,
            8,
            8
          ],
          "final_window_mean_zonal_fraction": 0.06303451041537982,
          "final_window_minimum_zonal_fraction": 0.06266611582335216,
          "final_window_modal_jet_count": 8,
          "final_window_modal_jet_count_occupancy": 1.0,
          "final_window_sample_count": 21,
          "final_window_tenth_percentile_zonal_fraction": 0.06273944546425206,
          "initial_energy": 0.009999999999999998,
          "initial_enstrophy": 0.24484432699819603,
          "jet_claim_admitted": false,
          "jet_count": 8,
          "jet_prominence_threshold": 0.007071067811865475,
          "spectral_zonal_energy_fraction": 0.0634047975333728,
          "zonal_kinetic_energy_fraction": 0.06340479753337282
        },
        "f_plane_identity": {
          "energy_budget_residual": 2.767024782045213e-12,
          "enstrophy_budget_residual": 1.5882175262438292e-10,
          "final_energy": 0.00968275353345125,
          "final_enstrophy": 0.23694217741213464,
          "final_vorticity_sha256": "206b4030a9a1080fa7b0965daa25b6d7cab922eb2668cbe4b7e4cf65d91ecbda",
          "final_window_jet_counts": [
            8,
            8,
            8,
            8,
            8,
            8,
            8,
            8,
            8,
            8,
            8,
            8,
            8,
            8,
            8,
            8,
            8,
            8,
            8,
            8,
            8
          ],
          "final_window_mean_zonal_fraction": 0.06311157267337963,
          "final_window_minimum_zonal_fraction": 0.06272661932422083,
          "final_window_modal_jet_count": 8,
          "final_window_modal_jet_count_occupancy": 1.0,
          "final_window_sample_count": 21,
          "final_window_tenth_percentile_zonal_fraction": 0.06280303739234502,
          "initial_energy": 0.009999999999999998,
          "initial_enstrophy": 0.24484432699819603,
          "jet_claim_admitted": false,
          "jet_count": 8,
          "jet_prominence_threshold": 0.007071067811865475,
          "spectral_zonal_energy_fraction": 0.06349962340441791,
          "zonal_kinetic_energy_fraction": 0.06349962340441792
        }
      },
      "comparisons": {
        "beta_to_f_plane_relative_vorticity_l2": 0.36429919669003646,
        "quotient_to_identity_maximum_vorticity_error": 0.0
      },
      "criteria": {
        "beta_sensitivity_passed": true,
        "budget_passed": true,
        "negative_control_passed": true
      },
      "grid_size": 24,
      "seed": 11,
      "steps": 100,
      "time_step": 0.005
    },
    {
      "arms": {
        "beta_plane_e7_quotient": {
          "energy_budget_residual": 9.963842522320993e-12,